{"id":"root","children":[{"id":"Noutside","children":[{"id":"Noutside.insideOtherLayout","children":[{"id":"Noutside.insideOtherLayout.child1","layoutOptions":{"nodeSize.constraints":"[]","nodeLabels.placement":"[]","portLabels.placement":"[OUTSIDE]","margins":"[top=0.0,left=0.0,bottom=0.0,right=0.0]","nodeSize.options":"[DEFAULT_MINIMUM_SIZE]"},"x":148.92423315100032,"y":64.62860538419602,"width":60.0,"height":30.0},{"id":"Noutside.insideOtherLayout.child2","layoutOptions":{"nodeSize.constraints":"[]","nodeLabels.placement":"[]","portLabels.placement":"[OUTSIDE]","margins":"[top=0.0,left=0.0,bottom=0.0,right=0.0]","nodeSize.options":"[DEFAULT_MINIMUM_SIZE]"},"x":50.0,"y":50.0,"width":60.0,"height":30.0}],"layoutOptions":{"algorithm":"elk.stress","childAreaHeight":"44.62860538419602","elk.padding":"[top=50.0,left=50.0,bottom=50.0,right=50.0]","nodeSize.constraints":"[]","spacing.portsSurrounding":"[top=0.0,left=0.0,bottom=0.0,right=0.0]","childAreaWidth":"158.9242331510003","layering.layerId":"-1","crossingMinimization.positionId":"-1","resolvedAlgorithm":"Layout Algorithm: org.eclipse.elk.stress","nodeLabels.padding":"[top=5.0,left=5.0,bottom=5.0,right=5.0]","hierarchyHandling":"SEPARATE_CHILDREN"},"x":12.0,"y":12.0,"width":258.9242331510003,"height":144.62860538419602,"edges":[{"id":"e0","sources":["Noutside.insideOtherLayout.child1"],"targets":["Noutside.insideOtherLayout.child2"],"sections":[{"id":"s0","startPoint":{"x":148.92423315100032,"y":75.19229946048978},"endPoint":{"x":110.0,"y":69.43630592370624}}]}]}],"layoutOptions":{"portLabels.placement":"[OUTSIDE]","nodeLabels.placement":"[]","nodeSize.constraints":"[]","layering.layerId":"-1","crossingMinimization.positionId":"-1","resolvedAlgorithm":"Layout Algorithm: org.eclipse.elk.layered","nodeSize.options":"[DEFAULT_MINIMUM_SIZE]","hierarchyHandling":"INCLUDE_CHILDREN"},"x":12.0,"y":12.0,"width":282.9242248535156,"height":168.62860538419602}],"layoutOptions":{"portLabels.placement":"[OUTSIDE]","nodeLabels.placement":"[]","elk.direction":"RIGHT","algorithm":"org.eclipse.elk.layered","nodeSize.constraints":"[]","spacing.portsSurrounding":"[top=0.0,left=0.0,bottom=0.0,right=0.0]","resolvedAlgorithm":"Layout Algorithm: org.eclipse.elk.layered","nodeSize.options":"[DEFAULT_MINIMUM_SIZE]","randomSeed":"1","hierarchyHandling":"INCLUDE_CHILDREN","nodeLabels.padding":"[top=5.0,left=5.0,bottom=5.0,right=5.0]"},"width":306.9242248535156,"height":192.62860538419602}