{"id":"root","layoutOptions":{"org.eclipse.elk.direction":"RIGHT","org.eclipse.elk.randomSeed":"1","org.eclipse.elk.hierarchyHandling":"INCLUDE_CHILDREN"},"children":[{"id":"NoutsideTopToBottom","width":60,"height":30,"labels":[{"text":"topToBottom","width":0,"height":0}],"layoutOptions":{"org.eclipse.elk.direction":"DOWN","org.eclipse.elk.nodeLabels.placement":"H_LEFT V_TOP OUTSIDE"},"children":[{"id":"NoutsideTopToBottom.leftToRight","width":60,"height":30,"labels":[{"text":"leftToRight","width":0,"height":0}],"layoutOptions":{"org.eclipse.elk.direction":"RIGHT","org.eclipse.elk.nodeLabels.placement":"H_LEFT V_BOTTOM OUTSIDE"},"children":[{"id":"NoutsideTopToBottom.leftToRight.n1","width":60,"height":30},{"id":"NoutsideTopToBottom.leftToRight.n2","width":60,"height":30}]},{"id":"NoutsideTopToBottom.bottomToTop","width":60,"height":30,"labels":[{"text":"bottomToTop","width":0,"height":0}],"layoutOptions":{"org.eclipse.elk.direction":"UP","org.eclipse.elk.nodeLabels.placement":"H_LEFT V_TOP OUTSIDE"},"children":[{"id":"NoutsideTopToBottom.bottomToTop.n1","width":60,"height":30},{"id":"NoutsideTopToBottom.bottomToTop.n2","width":60,"height":30}]}]}],"edges":[{"id":"e0","sources":["NoutsideTopToBottom.leftToRight.n1"],"targets":["NoutsideTopToBottom.leftToRight.n2"]},{"id":"e1","sources":["NoutsideTopToBottom.bottomToTop.n1"],"targets":["NoutsideTopToBottom.bottomToTop.n2"]},{"id":"e2","sources":["NoutsideTopToBottom.bottomToTop"],"targets":["NoutsideTopToBottom.leftToRight"]}]}